{
  "record_type": "ranking_category_inventory",
  "schema_version": "v1",
  "inventory_id": "test-2026-best-colleges-v1",
  "inventory_version": "2026-best-colleges-v1",
  "ranking_system": "u_s_news",
  "ranking_family": "undergraduate_program",
  "edition": "2026 Best Colleges",
  "publication_date": "2025-09-23",
  "discovery_date": "2026-07-10",
  "categories": [
    {
      "canonical_category_id": "undergraduate-business-programs",
      "official_display_name": "Undergraduate Business Programs",
      "ranking_family": "undergraduate_program",
      "edition": "2026 Best Colleges",
      "publication_date": "2025-09-23",
      "undergraduate_status": true,
      "inclusion_status": "included",
      "inclusion_reason": "undergraduate academic program ranking",
      "exclusion_reason": null,
      "source_ids": ["test-source-best-colleges"],
      "accessibility_status": "partially_public",
      "last_verified_at": "2026-07-10T00:00:00Z",
      "lineage": {"change_type": "new", "previous_category_ids": []}
    }
  ]
}
